<?xml version="1.0" encoding="UTF-8" standalone="no" ?>
<Measurement xmlns:xsi="http://www.w3.org/2001/XMLSchema-instance" xsi:noNamespaceSchemaLocation="C:\Users\e14user\Documents\LabVIEW software\GitRepo\lib\Config\validator.xsd">
<Loop>
<Position>
<X>-15416.600</X>
<Y>8806.800</Y>
<Focus>408.60</Focus>
</Position>
<Position>
<X>-15416.600</X>
<Y>6947.500</Y>
<Focus>408.60</Focus>
</Position>
<Position>
<X>-15416.600</X>
<Y>4889.000</Y>
<Focus>408.60</Focus>
</Position>
<Position>
<X>-15416.600</X>
<Y>2875.200</Y>
<Focus>408.60</Focus>
</Position>
<Position>
<X>-15416.600</X>
<Y>1170.500</Y>
<Focus>408.60</Focus>
</Position>
<Position>
<X>-15416.600</X>
<Y>-777.100</Y>
<Focus>408.60</Focus>
</Position>
<Position>
<X>-15416.600</X>
<Y>-2693.000</Y>
<Focus>408.60</Focus>
</Position>
<Position>
<X>-15416.600</X>
<Y>-4553.100</Y>
<Focus>408.60</Focus>
</Position>
<Position>
<X>-18700.800</X>
<Y>2941.100</Y>
<Focus>408.00</Focus>
</Position>
<Position>
<X>-11486.400</X>
<Y>2340.200</Y>
<Focus>408.00</Focus>
</Position>
</Loop>
</Measurement>